block_name,attribute,smspp_object,netcdf_component,netcdf_base_type,dimension,unit,default,status,description
AbstractPath,block_type,Attribute,Attribute,str,-,-,,required,Type of the block
AbstractPath,id,Attribute,Attribute,str,-,-,,optional,Id of the block
AbstractPath,PathDim,Dimension,Dimension,int,-,-,,required,Number of paths
AbstractPath,TotalLength,Dimension,Dimension,int,-,-,,required,Total number of nodes across all paths
AbstractPath,PathStart,Variable,Variable,int,-|PathDim,-,,required,Start index of each path
AbstractPath,PathNodeTypes,Variable,Variable,str,-|TotalLength,-,,required,Type of each node
AbstractPath,PathGroupIndices,Variable,Variable,int,-|TotalLength,-,,required,Group index per node
AbstractPath,PathElementIndices,Variable,Variable,int,-|TotalLength,-,,required,Element index per node
AbstractPath,PathRangeIndices,Variable,Variable,int,-|TotalLength,-,,required,Scenario range index per node